[
 {"id":0,"off_530":"2024-01-15T08:30:00+05:30","off_neg8":"2024-01-15T08:30:00-08:00","off_zero":"2024-01-15T08:30:00+00:00","z_upper":"2024-01-15T08:30:00Z","z_lower":"2024-01-15t08:30:00z","space_z":"2024-01-15 08:30:00Z","frac9":"2024-01-15T08:30:00.123456789Z","frac3z":"2024-01-15T08:30:00.000Z","off_nocolon":"2024-01-15T08:30:00+0530","off_hours":"2024-01-15T08:30:00+05","date_short":"2024-1-5","date_year0":"0000-03-01","t24":"24:00:00","time_z":"08:30:00Z","time_off":"08:30:00+05:30","time_frac":"08:30:00.500","leap":"2016-12-31T23:59:60Z","naive_min":"2024-01-15T08:30","date_ts":"2024-01-15T00:00:00"},
 {"id":1,"off_530":"2024-06-01T00:00:00+05:30","off_neg8":"2024-06-01T00:00:00-08:00","off_zero":"2024-06-01T00:00:00+00:00","z_upper":"2024-06-01T00:00:00Z","z_lower":"2024-06-01t00:00:00z","space_z":"2024-06-01 00:00:00Z","frac9":"2024-06-01T00:00:00.000000001Z","frac3z":"2024-06-01T00:00:00.120Z","off_nocolon":"2024-06-01T00:00:00-0800","off_hours":"2024-06-01T00:00:00-08","date_short":"2024-12-25","date_year0":"0001-01-01","t24":"23:00:00","time_z":"00:00:00Z","time_off":"00:00:00-08:00","time_frac":"00:00:00.000","leap":"2016-12-31T23:59:59Z","naive_min":"2024-06-01T00:00","date_ts":"2024-06-01T00:00:00"},
 {"id":2,"off_530":"2024-12-31T23:59:59+05:30","off_neg8":"2024-12-31T23:59:59-08:00","off_zero":"2024-12-31T23:59:59+00:00","z_upper":"2024-12-31T23:59:59Z","z_lower":"2024-12-31t23:59:59z","space_z":"2024-12-31 23:59:59Z","frac9":"2024-12-31T23:59:59.999999999Z","frac3z":"2024-12-31T23:59:59.999Z","off_nocolon":"2024-12-31T23:59:59+0000","off_hours":"2024-12-31T23:59:59+00","date_short":"2024-3-07","date_year0":"9999-12-31","t24":"12:00:00","time_z":"23:59:59Z","time_off":"23:59:59+00:00","time_frac":"23:59:59.999","leap":"2016-12-31T00:00:00Z","naive_min":"2024-12-31T23:59","date_ts":"2024-12-31T00:00:00"}
]
